{
  "name": "Egypt",
  "slug": "egypt",
  "confederation": "CAF",
  "group": "G",
  "fifa_ranking": 29,
  "coach": "Hossam Hassan",
  "squad": [
    { "name": "Mohamed El Shenawy", "position": "GK", "club": "Al Ahly", "club_country": "Egypt", "age": 37, "market_value_eur": 1000000 },
    { "name": "Mostafa Shobeir", "position": "GK", "club": "Al Ahly", "club_country": "Egypt", "age": 28, "market_value_eur": 1200000 },
    { "name": "El-Mahdi Soliman", "position": "GK", "club": "Ittihad Alexandria", "club_country": "Egypt", "age": 26, "market_value_eur": 800000 },
    { "name": "Mohamed Hany", "position": "DF", "club": "Al Ahly", "club_country": "Egypt", "age": 30, "market_value_eur": 2000000 },
    { "name": "Tarek Alaa", "position": "DF", "club": "ZED FC", "club_country": "Egypt", "age": 28, "market_value_eur": 1500000 },
    { "name": "Rami Rabia", "position": "DF", "club": "Al Ain", "club_country": "United Arab Emirates", "age": 31, "market_value_eur": 1500000 },
    { "name": "Yasser Ibrahim", "position": "DF", "club": "Al Ahly", "club_country": "Egypt", "age": 31, "market_value_eur": 2500000 },
    { "name": "Hossam Abdelmaguid", "position": "DF", "club": "Zamalek", "club_country": "Egypt", "age": 28, "market_value_eur": 1800000 },
    { "name": "Mohamed Abdelmonem", "position": "DF", "club": "Nice", "club_country": "France", "age": 27, "market_value_eur": 8000000 },
    { "name": "Ahmed Fattouh", "position": "DF", "club": "Zamalek", "club_country": "Egypt", "age": 28, "market_value_eur": 1500000 },
    { "name": "Karim Hafez", "position": "DF", "club": "Pyramids FC", "club_country": "Egypt", "age": 29, "market_value_eur": 1500000 },
    { "name": "Ahmed Hegazi", "position": "DF", "club": "Al Ittihad", "club_country": "Saudi Arabia", "age": 35, "market_value_eur": 1000000 },
    { "name": "Marwan Attia", "position": "MF", "club": "Al Ahly", "club_country": "Egypt", "age": 25, "market_value_eur": 3000000 },
    { "name": "Mohanad Lasheen", "position": "MF", "club": "Pyramids FC", "club_country": "Egypt", "age": 26, "market_value_eur": 2500000 },
    { "name": "Nabil Emad", "position": "MF", "club": "Al-Najma", "club_country": "Saudi Arabia", "age": 22, "market_value_eur": 1500000 },
    { "name": "Mahmoud Saber", "position": "MF", "club": "ZED FC", "club_country": "Egypt", "age": 23, "market_value_eur": 2000000 },
    { "name": "Ahmed Sayed Zizo", "position": "MF", "club": "Al Ahly", "club_country": "Egypt", "age": 29, "market_value_eur": 5000000 },
    { "name": "Emam Ashour", "position": "MF", "club": "Al Ahly", "club_country": "Egypt", "age": 27, "market_value_eur": 6000000 },
    { "name": "Mostafa Ziko", "position": "MF", "club": "Pyramids FC", "club_country": "Egypt", "age": 24, "market_value_eur": 2000000 },
    { "name": "Ibrahim Adel", "position": "MF", "club": "FC Nordsjaelland", "club_country": "Denmark", "age": 24, "market_value_eur": 4000000 },
    { "name": "Haitham Hassan", "position": "MF", "club": "Real Oviedo", "club_country": "Spain", "age": 23, "market_value_eur": 3000000 },
    { "name": "Mohamed Salah", "position": "FW", "club": "Liverpool", "club_country": "England", "age": 33, "market_value_eur": 40000000 },
    { "name": "Omar Marmoush", "position": "FW", "club": "Manchester City", "club_country": "England", "age": 27, "market_value_eur": 75000000 },
    { "name": "Mahmoud Trezeguet", "position": "FW", "club": "Al Ahly", "club_country": "Egypt", "age": 31, "market_value_eur": 4000000 },
    { "name": "Aqtay Abdallah", "position": "FW", "club": "Enppi", "club_country": "Egypt", "age": 24, "market_value_eur": 1200000 },
    { "name": "Hamza Abdelkareem", "position": "FW", "club": "Barcelona Atletic", "club_country": "Spain", "age": 18, "market_value_eur": 2000000 }
  ]
}
