{
  "name": "Switzerland",
  "slug": "switzerland",
  "confederation": "UEFA",
  "group": "B",
  "fifa_ranking": 19,
  "coach": "Murat Yakin",
  "squad": [
    { "name": "Gregor Kobel", "position": "GK", "club": "Borussia Dortmund", "club_country": "Germany", "age": 28, "market_value_eur": 38000000 },
    { "name": "Yvon Mvogo", "position": "GK", "club": "FC Lorient", "club_country": "France", "age": 32, "market_value_eur": 2500000 },
    { "name": "Marvin Keller", "position": "GK", "club": "BSC Young Boys", "club_country": "Switzerland", "age": 23, "market_value_eur": 7000000 },
    { "name": "Manuel Akanji", "position": "DF", "club": "Inter Milan", "club_country": "Italy", "age": 30, "market_value_eur": 17000000 },
    { "name": "Nico Elvedi", "position": "DF", "club": "Borussia Mönchengladbach", "club_country": "Germany", "age": 29, "market_value_eur": 8000000 },
    { "name": "Ricardo Rodriguez", "position": "DF", "club": "Real Betis", "club_country": "Spain", "age": 33, "market_value_eur": 2500000 },
    { "name": "Silvan Widmer", "position": "DF", "club": "FC Basel", "club_country": "Switzerland", "age": 33, "market_value_eur": 2000000 },
    { "name": "Miro Muheim", "position": "DF", "club": "Hamburger SV", "club_country": "Germany", "age": 28, "market_value_eur": 2600000 },
    { "name": "Eray Cömert", "position": "DF", "club": "Valencia", "club_country": "Spain", "age": 28, "market_value_eur": 2500000 },
    { "name": "Aurèle Amenda", "position": "DF", "club": "Eintracht Frankfurt", "club_country": "Germany", "age": 22, "market_value_eur": 6000000 },
    { "name": "Luca Jaquez", "position": "DF", "club": "VfB Stuttgart", "club_country": "Germany", "age": 23, "market_value_eur": 10000000 },
    { "name": "Granit Xhaka", "position": "MF", "club": "Sunderland", "club_country": "England", "age": 33, "market_value_eur": 10000000 },
    { "name": "Denis Zakaria", "position": "MF", "club": "AS Monaco", "club_country": "France", "age": 29, "market_value_eur": 30000000 },
    { "name": "Remo Freuler", "position": "MF", "club": "Bologna", "club_country": "Italy", "age": 34, "market_value_eur": 3000000 },
    { "name": "Ardon Jashari", "position": "MF", "club": "AC Milan", "club_country": "Italy", "age": 23, "market_value_eur": 30000000 },
    { "name": "Djibril Sow", "position": "MF", "club": "Sevilla", "club_country": "Spain", "age": 29, "market_value_eur": 7000000 },
    { "name": "Michel Aebischer", "position": "MF", "club": "Pisa", "club_country": "Italy", "age": 29, "market_value_eur": 4000000 },
    { "name": "Fabian Rieder", "position": "MF", "club": "FC Augsburg", "club_country": "Germany", "age": 24, "market_value_eur": 8000000 },
    { "name": "Johan Manzambi", "position": "MF", "club": "SC Freiburg", "club_country": "Germany", "age": 20, "market_value_eur": 20000000 },
    { "name": "Christian Fassnacht", "position": "MF", "club": "BSC Young Boys", "club_country": "Switzerland", "age": 32, "market_value_eur": 2000000 },
    { "name": "Rubén Vargas", "position": "FW", "club": "Sevilla", "club_country": "Spain", "age": 27, "market_value_eur": 12000000 },
    { "name": "Breel Embolo", "position": "FW", "club": "Stade Rennais", "club_country": "France", "age": 29, "market_value_eur": 15000000 },
    { "name": "Dan Ndoye", "position": "FW", "club": "Nottingham Forest", "club_country": "England", "age": 25, "market_value_eur": 40000000 },
    { "name": "Noah Okafor", "position": "FW", "club": "Leeds United", "club_country": "England", "age": 26, "market_value_eur": 21000000 },
    { "name": "Zeki Amdouni", "position": "FW", "club": "Burnley", "club_country": "England", "age": 25, "market_value_eur": 12000000 },
    { "name": "Cédric Itten", "position": "FW", "club": "Fortuna Düsseldorf", "club_country": "Germany", "age": 29, "market_value_eur": 2000000 }
  ]
}
