{
  "name": "Canada",
  "slug": "canada",
  "confederation": "CONCACAF",
  "group": "B",
  "fifa_ranking": 30,
  "coach": "Jesse Marsch",
  "squad": [
    { "name": "Dayne St. Clair", "position": "GK", "club": "Inter Miami", "club_country": "United States", "age": 28, "market_value_eur": 7000000 },
    { "name": "Maxime Crépeau", "position": "GK", "club": "Orlando City", "club_country": "United States", "age": 32, "market_value_eur": 2000000 },
    { "name": "Owen Goodman", "position": "GK", "club": "Crystal Palace", "club_country": "England", "age": 22, "market_value_eur": 2000000 },
    { "name": "Alphonso Davies", "position": "DF", "club": "Bayern Munich", "club_country": "Germany", "age": 25, "market_value_eur": 55000000 },
    { "name": "Alistair Johnston", "position": "DF", "club": "Celtic", "club_country": "Scotland", "age": 27, "market_value_eur": 15000000 },
    { "name": "Moïse Bombito", "position": "DF", "club": "OGC Nice", "club_country": "France", "age": 26, "market_value_eur": 18000000 },
    { "name": "Derek Cornelius", "position": "DF", "club": "Olympique de Marseille", "club_country": "France", "age": 28, "market_value_eur": 7000000 },
    { "name": "Joel Waterman", "position": "DF", "club": "Chicago Fire", "club_country": "United States", "age": 29, "market_value_eur": 2000000 },
    { "name": "Niko Sigur", "position": "DF", "club": "Hajduk Split", "club_country": "Croatia", "age": 23, "market_value_eur": 5000000 },
    { "name": "Alfie Jones", "position": "DF", "club": "Middlesbrough", "club_country": "England", "age": 28, "market_value_eur": 5000000 },
    { "name": "Richie Laryea", "position": "DF", "club": "Toronto FC", "club_country": "Canada", "age": 31, "market_value_eur": 2000000 },
    { "name": "Luc de Fougerolles", "position": "DF", "club": "Fulham", "club_country": "England", "age": 20, "market_value_eur": 3000000 },
    { "name": "Stephen Eustáquio", "position": "MF", "club": "FC Porto", "club_country": "Portugal", "age": 29, "market_value_eur": 18000000 },
    { "name": "Ismaël Koné", "position": "MF", "club": "Sassuolo", "club_country": "Italy", "age": 23, "market_value_eur": 10000000 },
    { "name": "Tajon Buchanan", "position": "MF", "club": "Villarreal", "club_country": "Spain", "age": 27, "market_value_eur": 12000000 },
    { "name": "Mathieu Choinière", "position": "MF", "club": "Los Angeles FC", "club_country": "United States", "age": 27, "market_value_eur": 4000000 },
    { "name": "Jonathan Osorio", "position": "MF", "club": "Toronto FC", "club_country": "Canada", "age": 33, "market_value_eur": 2000000 },
    { "name": "Liam Millar", "position": "MF", "club": "Hull City", "club_country": "England", "age": 26, "market_value_eur": 6000000 },
    { "name": "Jacob Shaffelburg", "position": "MF", "club": "Los Angeles FC", "club_country": "United States", "age": 26, "market_value_eur": 5000000 },
    { "name": "Nathan Saliba", "position": "MF", "club": "Anderlecht", "club_country": "Belgium", "age": 22, "market_value_eur": 5000000 },
    { "name": "Ali Ahmed", "position": "MF", "club": "Norwich City", "club_country": "England", "age": 25, "market_value_eur": 4000000 },
    { "name": "Marcelo Flores", "position": "MF", "club": "Tigres UANL", "club_country": "Mexico", "age": 22, "market_value_eur": 4000000 },
    { "name": "Jonathan David", "position": "FW", "club": "Juventus", "club_country": "Italy", "age": 26, "market_value_eur": 45000000 },
    { "name": "Cyle Larin", "position": "FW", "club": "RCD Mallorca", "club_country": "Spain", "age": 30, "market_value_eur": 6000000 },
    { "name": "Tani Oluwaseyi", "position": "FW", "club": "Villarreal", "club_country": "Spain", "age": 25, "market_value_eur": 8000000 },
    { "name": "Promise David", "position": "FW", "club": "Union Saint-Gilloise", "club_country": "Belgium", "age": 25, "market_value_eur": 12000000 }
  ]
}
