{
  "name": "Algeria",
  "slug": "algeria",
  "confederation": "CAF",
  "group": "J",
  "fifa_ranking": 28,
  "coach": "Vladimir Petković",
  "squad": [
    {"name": "Luca Zidane", "position": "GK", "club": "Granada", "club_country": "Spain", "age": 28, "market_value_eur": 2000000},
    {"name": "Oussama Benbot", "position": "GK", "club": "USM Alger", "club_country": "Algeria", "age": 30, "market_value_eur": 800000},
    {"name": "Melvin Mastil", "position": "GK", "club": "Stade Nyonnais", "club_country": "Switzerland", "age": 26, "market_value_eur": 400000},
    {"name": "Achraf Abada", "position": "DF", "club": "USM Alger", "club_country": "Algeria", "age": 23, "market_value_eur": 1500000},
    {"name": "Rayan Aït-Nouri", "position": "DF", "club": "Manchester City", "club_country": "England", "age": 24, "market_value_eur": 50000000},
    {"name": "Zinedine Belaid", "position": "DF", "club": "JS Kabylie", "club_country": "Algeria", "age": 24, "market_value_eur": 1200000},
    {"name": "Rafik Belghali", "position": "DF", "club": "Hellas Verona", "club_country": "Italy", "age": 23, "market_value_eur": 4000000},
    {"name": "Ramy Bensebaini", "position": "DF", "club": "Borussia Dortmund", "club_country": "Germany", "age": 31, "market_value_eur": 15000000},
    {"name": "Samir Chergui", "position": "DF", "club": "Paris FC", "club_country": "France", "age": 27, "market_value_eur": 3000000},
    {"name": "Jaouen Hadjam", "position": "DF", "club": "Young Boys", "club_country": "Switzerland", "age": 23, "market_value_eur": 7000000},
    {"name": "Aïssa Mandi", "position": "DF", "club": "Lille", "club_country": "France", "age": 34, "market_value_eur": 3000000},
    {"name": "Mohamed Amine Tougai", "position": "DF", "club": "Espérance de Tunis", "club_country": "Tunisia", "age": 25, "market_value_eur": 3500000},
    {"name": "Houssem Aouar", "position": "MF", "club": "Al-Ittihad", "club_country": "Saudi Arabia", "age": 28, "market_value_eur": 14000000},
    {"name": "Nabil Bentaleb", "position": "MF", "club": "Lille", "club_country": "France", "age": 31, "market_value_eur": 6000000},
    {"name": "Hicham Boudaoui", "position": "MF", "club": "Nice", "club_country": "France", "age": 26, "market_value_eur": 12000000},
    {"name": "Farès Chaïbi", "position": "MF", "club": "Eintracht Frankfurt", "club_country": "Germany", "age": 23, "market_value_eur": 18000000},
    {"name": "Ibrahim Maza", "position": "MF", "club": "Bayer Leverkusen", "club_country": "Germany", "age": 20, "market_value_eur": 20000000},
    {"name": "Yassine Titraoui", "position": "MF", "club": "Charleroi", "club_country": "Belgium", "age": 24, "market_value_eur": 3000000},
    {"name": "Ramiz Zerrouki", "position": "MF", "club": "Twente", "club_country": "Netherlands", "age": 28, "market_value_eur": 7000000},
    {"name": "Mohamed Amine Amoura", "position": "FW", "club": "VfL Wolfsburg", "club_country": "Germany", "age": 25, "market_value_eur": 25000000},
    {"name": "Nadir Benbouali", "position": "FW", "club": "Győri ETO", "club_country": "Hungary", "age": 25, "market_value_eur": 2500000},
    {"name": "Adil Boulbina", "position": "FW", "club": "Al-Duhail", "club_country": "Qatar", "age": 26, "market_value_eur": 2000000},
    {"name": "Farès Ghedjemis", "position": "FW", "club": "Frosinone", "club_country": "Italy", "age": 24, "market_value_eur": 3000000},
    {"name": "Amine Gouiri", "position": "FW", "club": "Marseille", "club_country": "France", "age": 26, "market_value_eur": 30000000},
    {"name": "Riyad Mahrez", "position": "FW", "club": "Al-Ahli", "club_country": "Saudi Arabia", "age": 35, "market_value_eur": 8000000},
    {"name": "Anis Hadj Moussa", "position": "FW", "club": "Feyenoord", "club_country": "Netherlands", "age": 23, "market_value_eur": 12000000}
  ]
}
